"Id","Name pt-PT","Card Text"
200742,Kahina a feiticeira,Independente. 1 voto (titulado): Kahina pode chamar um referendo para infligir 1 de dano em cada servo que tem um de seus contadores de corrupção como uma ação política com +1 de furtividade.
200743,Kai Simmons,Sabá: Vampiros do Sabá titulados controlados por outros Matusaléns podem chamar um referendo para roubar Kai como uma ação política com +1 de furtividade.
200744,Kalila,Camarilla: Kalila recebe +1 de furtividade durante ações direcionadas a um local.
200745,Kalinda,Independente: Kalinda pode sangrar como +1 de sangrar como uma ação (D) com +1 de furtividade que custa 2 de sangue. Sangue Amaldiçoado.
201596,Kalinda,"Primogênito Camarilla: Durante seu turno, você pode queimar a vantagem para destravar Kalinda."
200746,"Kallista, Mestra Escultora",Camarilla.
200747,Kamaria,Laibon.
200748,Kamau Jafari,Laibon.
201597,Kamile Paukstys,Anarquista: +1 de sangrar.
200749,Kamiri wa Itherero,"Laibon: Vampiros mais jovens precisam queimar 1 de sangue para tentar bloquear Kamiri. Se um aliado bloquear Kamiri e combate ocorrer, queime o aliado no fim da ação."
200750,Kamiri wa Itherero,"Avançado, Laibon: Kamiri pode infligir 2 de dano que não pode ser previnido em um servo como uma ação (D).
[MERGED] Uma vez por ação, Kamiri pode queimar 1 de sangue para dar a um Laibon agente +1 de furtividade."
200751,Kanimana Belghazi,"Independente: Kanimana pode colocar um contador de pesquisa nela com uma ação com +1 de furtividade que custa 1 de sangue. Enquanto ela estiver pronta, seu tamanho de mão é +X, onde X é o número de contadores de pesquisa nela. Escarço."
200752,Kanya Akhtar,Independente: Sangue Amaldiçoado.
200753,Karen Suadela,"Príncipe Camarilla de Houston: Enquanto Karen for uma príncipe, eventos de Gehenna não a afetam. Ela recebe +1 de furtividade em ações indiretas."
200754,Karif al Numair,"Sabá: Durante o seu turno, você pode travar ou destravar outro vampiro pronto da Mão Negra. Mão Negra. +1 de força. +1 de sangrar."
200755,Karl,Sabá. Círculo de Torrence. Estéril.
201621,Karl Schrekt,Camarilla. 2 votos (titulado): Karl pode jogar cartas que requerem um justicar como se ele fosse um justicar. +1 de percepção.
200756,Karmenita Yoryari,Arcebispo Sabá de Lisboa: Karmenita pode queimar um equipamento ou local como uma ação (D) que custa 1 de sangue.
200757,Karsh,"Camarilla: Karsh pode entrar em combate com um vampiro não-Camarilla travado controlado por outro Matusalém como uma ação (D). Uma vez a cada rodada, ele pode queimar 1 de sangue para tratar o dano agravado como dano normal para a rodada atual."
200758,Karsh,"Camarilla: Karsh pode jogar cartas de /Caçada de Sangue/ de sua mão ou pilha de cinzas como um príncipe. Ele recebe +3 votos em referendos de Caçada de Sangue. Ele não pode bloquear vampiros infernalistas.
[MERGED] Imperador (3 votos): +1 de percepção."
200759,Kashan,Independente. 1 voto (titulado): Sangue amaldiçoado.
201598,Kasim Bayar,"Justicar Camarilla Banu Haqim: Uma vez por combate, Kasim pode descartar uma carta de ação política [POLITICAL ACTION] antes da distância ser determinada para receber +2 de força naquele combate. +1 de sangrar."
201604,Kassandra Tassaki,Príncipe Camarilla de Tessalônica.
200760,Kassiym Malikhair,"Sabá: Durante sua fase de destravar, você pode mover 1 de sangue de Kassiym para qualquer Pander pronto."
200761,Katarina,Principe Camarilla de Glasgow: Katarina recebe +1 de sangrar quando sangra um Matusalém que controla um Ravnos pronto.
200762,Katarina Kornfeld,"Primogênito Camarilla: Se outro vampiro pronto que você controla é um príncipe, Katarina recebe +1 de furtividade."
200763,Kateline Nadasdy,"Camarilla: Durante a etapa de votação de uma ação política, Kateline pode queimar 1 de sangue para forçar um vampiro não agente a se abster."
200764,Katherine Stoddard,"Sabá. Mão negra: Uma vez durante seu turno, se Katherine estiver pronta, você pode descartar uma carta que requer Auspícios [aus] de sua mão. Compre para seu tamanho de mão em seguida."
201552,Kathy Glens,Camarilla.
200765,Kay Polerno,Independente.
200766,Kazimir Savostin,"Sabá: Se Kazimir bloquear, ele recebe um pressionar opcional durante o combate resultante. Mão negra. Serafim."
201659,Keegan,"Anarquista: Uma vez por turno, Keegan pode destravar depois de realizar uma ação bem-sucedida que requer um Gangrel."
200767,Keith Moody,"Sabá: Durante sua fase de destravar, sua presa pode queimar a Vantagem para queimar 1 de sangue de Keith."
200768,Keller Thiel,"Camarilla: Se Keller estiver pronto e destravado, servos queimam 1 de sangue ou vida depois de te sangrarem com sucesso."
200769,Kemintiri,Independente: Kemintiri recebe +1 de sangrar e +1 de furtividade quando sangra um Matusalém que controla um Ventrue. Qualquer Ventrue pode entrar em combate com ela com uma ação (D). Ela pdoe entrar em combate com um ventrue com uma ação (D) com +1 de furtividade.
200770,Kemintiri,"Independente: Lista vermelha. +1 de furtividade.
[MERGED] 3 votos (titulado): Kementiri pode jogar cartas de servo que requerem um vampiro da Camarilla, um ventrue, e/ou um Justicar como se ela atendesse a estes requerimentos."
200771,Kendrick,"Priscus Sabá: Se Kendrick estiver pronto durante sua fase mestra, você pode olhar uma carta aleatória da mão de sua presa. Se for uma carta de ação política, sua presa descarta a carta."
200772,Kenyatta,Laibon.
200773,"Kephamos, Alto Sacerdote de Marrakech",Independente. 2 votos (titulado): +1 de sangrar.
200774,"Kervos, o Tenente",Sabá.
200775,Kestrelle Hayes,Sabá. Mão Negra: Kestrelle recebe +1 de furtividade durante ações direcionadas a um Matusalém que não controla um vampiro do sabá pronto.
201629,Kevin Jackson,Príncipe Camarilla de Chicado: Kevin ganha +1 de força em combate contra Brujah. Brujah ganha +1 de força em combate contra ele.
201599,Khadija Al-Kindi,Primogênito Camarilla.
200776,Khalid,"Primogênito Camarilla: Durante sua fase mestra, se Khalid estiver pronto, você pode usar uma ação de fase mestra e descartar uma carta que requer Ofuscação [obf] de sua mão para ganhar um de recurso."
200777,Khalil Anvari,Independente.
200778,Khalil Ravana,Independente: Khalil recebe +1 de furtividade durante ações de diablerie.
200779,Khalu,Laibon: Khalu pode queimar 5 sangue para cancelar uma carta de servo jogada por seu predador ou presa conforme ela for jogada (e seu custo não é pago).
200780,"Khay'tall, Serpente do Eden",Independente: Kay'tall recebe +1 de furtividade durante ações políticas. Vampiros com quaisquer contadores de corrupção não podem lançar votos ou balotes durante referendos chamados por Khay'tall.
200781,Khurshid,Sabá: +2 de força.
200782,Kij Dansky,Priscus Sabá.
200783,o Kikiyaon,"Laibon: Uma vez por combate, o Kikiyaon pode queimar 1 de sangue para ganhar uma manobra. Vôo [FLIGHT]."
200784,Kiradin,"Independente: Uma vez por rodada, Kiradin pode queimar 1 de sangue para receber 1 golpe adicional (limitado)."
200785,Kisha Bhimji,Magaji Laibon: Kisha recebe -1 de furtividade em ações que não sejam de caçar.
200786,Kite,Bispo Sabá: +1 de percepção.
200787,Klaus Konrecht,Cardeal Sabá.
200788,Klaus van der Veken,Príncipe Camarilla de Amsterdã: Klaus pode cancelar os efeitos de um dos campos de caça de sua presa.
200789,KoKo,Camarilla.
200790,Konrad Fleischer,"Sabá: Uma vez por rodada, Konrad pode tratar 1 de dano agravado como normal. Ele recebe um pressionar opcional a cada combate."
200791,Korah,Priscus Sabá.
200792,"Kostantin, Baro da Caravana",Independente: Kostantin pode roubar um equipamento como uma ação (D) com +1 de furtividade.
200793,Krassimir,"Independente: Uma vez por turno, quando for bloqueado, Krassimir pode destravar e cancelar a ação atual e o combate (não trave o servo bloqueador). Krassimir não pode usar cartas que requerem Rapidez [cel]. Escarço."
200794,Krid,Camarilla.
200795,Kurt Densch,"Camarilla: Durante sua fase de destravar, você pode olhar a carta do topo de sua biblioteca, e Kurt pode queimar 1 de sangue para mover aquela carta para o fundo de sua biblioteca. +1 de percepção."
200796,Kurt Strauss,Sabá.
201574,Kuyén,Barão Anarquista de Santiago: Animais (aliados e lacaios) custam a Kuyén -1 de sangue ou recurso.
200797,"Kyle Strathcona, Cardeal do Canadá","Cardeal Sabá: Durante sua fase de destravar, você pode mover 1 de sangue de Kyle para qualquer outro vampiro Sabá controlado."
200798,Kyoko Shinsegawa,Camarilla: Kyoko não pode caçar normalmente. Ela pode caçar roubando 1 de sangue de outro vampiro pronto com uma ação (D) com +1 de furtividade.
200799,Kyrylo,Sabá: Círculo de Kiev. Estéril.
200800,L'Épuisette,Sabá: L'Épuisette recebe +1 de sangrar contra um Matusalém que controla um Toreador pronto.
200801,La Viuda Blanca,Sabá: La Viuda pode comprar até 2 cartas como uma ação com +1 de furtividade (descarte em sequência).
200802,"Lachlan, Nodista",Arcebispo Sabá de Chicago.
200803,"Ladislas Toth, a Tocha",Arcebispo Sabá de Frankfurt.
200804,Lady Constancia,Indepentende. 2 votos (titulado): Você pode queimar a Vantagem e usar uma ação de fase de descarte para descartar uma carta aleatóriamente e comprar sua reposição das outras cartas de biblioteca em sua pilha de cinzas.
201643,Dama Scarlett Churchill,Camarilla: Você e Dama Scarlett podem jogar cartas que requerem Toreador como se ela fosse uma Toreador.
201516,Lady Vadislava,"Priscus Sabá: Uma vez por rodada, Lady Vadislava pode queimar 1 de sangue para fazer com que seus golpes de mão sejam agravados nesta rodada."
200805,Lady Zara Slatikov,Bispo Sabá : Zara recebe um pressionar opcional a cada combate. Ela pode entrar em combate com um Baali como uma ação (D).
200806,Laecanus,"Camarilla: Uma vez por combate, Laecanos pode pressionar para terminar o combate.  Cartas de Frenesi  não podem ser jogadas nele."
200807,Laika,Sabá: Laika pode queimar 1 de sangue para golpear: 2di de dano.
200808,Lailah,Sabá.
200809,Lalitha,Independente.
200810,Lambach,"Cardeal Sabá: Uma vez por combate, Lambach pode queimar 1 de sangue para fazer com que o dano de seus golpes de mão seja agravado naquela rodada. +1 de força."
200811,Lambach,"Indepentende. 2 votos (titulado): Lambach pode procurar em sua biblioteca por uma carta chamada Olho de Hazimel e equipá-la sem custo como uma ação com +1 de furtividade (embaralhe em seguida).
[MERGED] Lambach pode destravar depois de realizar uma ação de colocar um vampiro em jogo com sucesso."
200812,Lana Butcher,Camarilla.
200813,Langa,Laibon: Langa pode entrar em combate com um vampiro controlado por outro Matusalém como uma ação (D).
201553,Larissa Moreira,"Primogênito Camarilla: Durante uma ação de sangrar, Larissa pode descartar uma carta que requer Animalismo [ani] para receber +1 de sangrar."
200814,Larry,"Sabá. Círculo de Chicago: Uma vez por ação, Larry pode queimar 1 de sangue para receber +1 de percepção. Estéril."
200815,Laszlo Mirac,"Bispo Sabá: Quando Laszlo chama um referendo, ele pode escolher um vampiro mais jovem. O vampiro escolhido não pode lançar votos ou balotes naquele referendo. +1 de sangrar."
200816,Laura Goldman,Anarquista.
201554,Lauren,Camarilla.
200817,Laurent de Valois,Camarilla.
200818,Layla bint-Nadr,Independente: Sangue Amaldiçoado.
200819,Lázár Dobrescu,Independente: Lázár pode mover 1 de sangue de uma carta de cripta na região não-controlada de sua presa para um vampiro em sua região não-controlada como uma ação (D).
200820,Lazarus,Primogênito Camarilla: Lazarus pode causar 1Di de dano como um golpe.
200821,Lazarus,"Avançado, Primogênito Camarilla: Lazarus recebe uma manobra opcional a cada combate.
[MERGED] Uma vez por combate, Lazarus pode queimar 1 de sangue para receber um pressionar, somente utilizável para continuar o combate."
200822,Lazarus James,Camarilla: +1 de sangrar.
200823,"Lazverinus, Vassalo de  Lambach",Arcebispo Sabá de Houston: +2 de força.
200824,Le Dinh Tho,Independente: Tho pode olhar a mão de outro Matusalém e descartar uma carta de lá como uma ação (D) com +1 de furtividade (aquele Matusalém compra para voltar a seu tamanho de mão na sequência). Tho recebe -1 de furtividade quando caça. Escarço.
200825,"Leaf ""Potter116"" Pankowski","Durante sua fase de descarte, Leaf pode travar para ganhar uma convicção  [1 CONVICTION] de sua biblioteca (embaralhe em seguida), mão ou pilha de cinzas."
200826,Leandro,"Círculo interno Malkaviano da Camarilla: Durante a fase de destravar de cada outro Matusalém, se Leandro estiver pronto, aquele Matusalém escolhe queimar 1 de recurso ou perder todas as suas transferências até sua próxima fase de influência. +2 de sangrar."
200827,Lectora,Sabá.
200828,Legba,Arcebispo Sabá de Porto do Príncipe: Ministros controlados por outros Matusaléns não podem lançar votos ou balotes em referendos chamados por Legba.
200829,Leila Monroe,Sabá: Leila pode mudar a seita de um Anarquista sem sangue para Sabá com uma ação (D) com +1 de furtividade.
201622,Len Konopka,"Sabá: Se Len estiver pronto durante o início de sua fase de influência, você recebe +1 transferência. Mão Negra."
200830,Lena Rowe,Sabá: Lena não pode receber nenhum título.
201555,Lenny Burkhead,Primogênito Camarilla. +1 de sangrar.
200831,Leo Washington,Sabá: Um vampiro mais velho se opondo a Leo em combate recebe uma manobra opcional na primeira rodada daquele combate.
200832,Leon,Sabá: Gangrel antitribu recebem -1 de percepção quando tentam bloquear Leon.
200833,Lernean,"Cardeal Sabá: Uma vez por rodada, Lernean pode queimar 1 de sangue para receber um golpe adicional (limitado)."
201526,Leumeah,Barão Anarquista de Camberra.
200834,Lia Milliner,Independente.
200835,Lille Haake,"Primogênito Camarilla: Lille recebe +1 de sangrar quando sangra um Matusalém que controla um vampiro Sabá pronto. Durante sua fase mestra, você pode usar uma ação de fase mestra para descartar uma carta de sua mão."
200836,Lillian,Independente.
200837,Lin Jun,"Camarilla: Se Jun estiver em torpor, vampiros com Feitiçaria de Sangue [tha] controlados por seu predador recebem +1 de sangrar."
200838,Lindsay Yates,Camarilla.
200839,Lisa Noble,Camarilla: Lisa recebe -1 de força na primeira rodada de combate.
200840,Lisandro Giovanni,Independente: Você e Lisandro podem jogar cartas que requerem um Samedi ou Ventrue Antitribu como se ele fosse do clã requerido. +1 de furtividade.
200841,Lisé,Independente.
200842,Lisette Vizquel,Bispo Sabá: Lisette recebe +1 de percepção durante ações de diablerie.
200843,Lithrac,Camarilla: Você recebe 2 votos adicionais em referendos para chamar caçadas de sangue contra Lithrac. Lithrac recebe +1 de furtividade quando faz uma ação para entrar em combate com outro servo.
200844,Pequeno Alfaiate de Praga,Sabá: Aliados e lacaios que requerem Tzimisce ou Vicissitude [vic] custam ao alfaiate -1 de sangue ou recursos. +1 de sangrar.
200845,Little Willie,Sabá.
200846,"Liz ""Ticket312"" Thornton",Liz não ganha uma convicção [1 CONVICTION] quando entra em jogo normalmente.
200847,Lizette,"Independente: Lizette pode previnir 1 de dano a cada combate. Durante uma ação de sangrar, ela pode queimar 1 de sangue para receber +1 de sangrar."
201556,Lloyd Brooks,Primogênito Camarilla.
200848,Lodin (Olaf Holte),"Príncipe Camarilla de Chicago: Uma vez por combate, Lodin pode prevenir 1 de dano do golpe do servo oponente."
200849,Lolita,Sabá.
200850,Lolita Houston,Sabá.
200851,Loonar,Sabá.
200852,Lord Aaron Wesley Wilkshire,Sabá. Mão Negra: Cartas de Frenesi jogadas em Aaron custam um de sangue ou recursos adicionais.
200853,Lord Ashton,"Independente: Qualquer outro Gangrel pode procurar na biblioteca de seu controlador por uma carta mestra de disciplina de Animalismo, Fortitude ou Metamorfose e movê-la para si mesmo como uma ação com +1 de furtividade."
200854,Lord Ephraim Wainwright,"Camarilla: Você pode buscar em sua biblioteca por uma cópia de uma carta de ação que Ephraim jogar depois que ela for jogada e mover está cópia para sua pilha de cinzas (embaralhe em sequência). Se a ação for bem-suscedida, mova a carta para sua mão."
200855,Lord Fianna,Camarilla: Aliados não podem bloquear Lorde Fianna. Lista Vermelha. +1 de furtividade.
201517,Lord Leopold Valdemar,Priscus Sabá: Leopold pode golpear a distância: roube 2 de sangue.
200856,Lord Tremere,"Camarilla: Cartas que requerem Taumaturgia [tha] custam a Lorde Tremere 1 de sangue a menos. Durante sua fase de servo, você pode travar ou destravar outro Tremere ou Tremere antitribu. +2 de sangrar. +1 de percepção."
200857,Lord Vauxhall,Sabá.
200858,Lorenzo Detuono,"Independente: Se Lorenzo estiver pronto no fim de um combate e o servo opositor não estiver, Lorenzo pode queimar 5 de sangue para mover o servo opositor para sua região pronta, com 1 de vida para um aliado sem vida. Lista Vermelha."
200859,Lorrie Dunsirn,"Independente: Lorrie não pode jogar cartas de reação, possuir equipamentos ou lacaios, manobrar para longa distância ou pressionar para terminar o combate. Ela recebe um golpe adicional (limitado) a cada rodada e um pressionar a cada combate. Ações que não sejam de caçar custam a ela 1 de recurso adicional. +1 de força. Escarço. Estéril."
200860,Louhi,"Cardeal Sabá: Uma vez por turno, se Louhi estiver pronta, ela pode queimar 1 de sangue para cancelar uma carta de ação controlada por seu predador conforme ela for jogada (o servo agente não trava)."
200861,Louis de Maisonneuve,Sabá.
200862,Louis Fortier,Camarilla.
200863,Louis Fortier,"Anarquista.
[MERGED] Louis recebe +1 nível de Dominação [dom] e Presença [pre]."
200864,Luanda Magere,Laibon: Luanda recebe +1 de força para cada Orun que possuir.
200865,Lubomira Hradok,"Sabá. Mão Negra: Se Lubomira sangrar com sucesso um Matusalém que controla um vampiro pronto titulado, ela não destrava normalmente durante sua próxima fase de destravar."
200866,Luc,Sabá: Luc recebe +1 de furtividade em ações de diablerie. Ele pode te dar +3 de tamanho de mão até sua próxima fase de destravar com uma ação com +1 de furtividade.
200867,Luca Italicus,"Arcebispo Sabá da Filadélfia: Uma vez por rodada de combate, após a primeira, Luca pode golpear: 2Di de dano."
200868,Lucas Halton,"Príncipe Camarilla de Houston: Uma vez por turno, quando Lucas bloqueia uma ação, ele pode queimar 1 de sangue ao invés de travar para bloquear (antes do combate ocorrer)."
200869,Luccia Paciola,Camarilla: +1 de força.
200870,Lucian,Justicar Malkaviano da Camarilla: Lucian pode roubar um equipamento com um golpe.
200871,"Lucian, ao perfeito",Laibon: Golpes contra Lucian custam 1 de sangue ou recurso adicional. Um servo se opondo a Lucian pode escolher não golpear. +3 de sangrar.
201675,Luciano Carvalho,"Anarquista: Durante sua fase de descarte, você pode mover um lacaio animal de um vampiro que você controla para outro vampiro que você controla."
200872,Lucina,"Primogênito Camarilla: Lucina recebe +1 de força em combate com um vampiro cuja capacidade seja 4 ou menos. Durante sua fase de destravar, se você controlar a Vantagem, Lucina ganha 1 de sangue."
200873,"Lucinde, Alastor","Justicar Ventrue da Camarilla: Lucinde pode entrar em combate com um vampiro pronto não-camarilla controlado por outro Matusalém como uma ação (D). Durante sua fase de destravar, você pode queimar a Vantagem para dar a Lucinde 1 de sangue do banco de sangue."
200874,Lucita,Independente: Vampiros mais jovens do Sabá recebem -1 de percepção contra Lucita.
200875,Lucita,"Sabá: Durante uma ação realizada por Lucita, ela pode queimar 2 de sangue para cancelar uma carta de reação conforme ela for jogada por um vampiro com capacidade 5 ou menos, e seu custo não é pago.
[MERGED] Arcebispo de Aragon."
200876,"Lucretia, Rainha Cess",Primogênito Camarilla: +1 de furtividade.
200877,Lucubratio,"Arcebispo Sabá de Brussels: Uma vez por turno,  quando Lucubratio bloqueia, ele pode descartar uma carta que requer Auspícios [aus] de sua mão ao invés de travar para o bloqueio."
200878,Lucy Markowitz,Sabá.
200879,Ludmijla Rakoczy,Bispo Sabá: Cartas que requerem Animalismo [ani] custam 1 de sangue a menos para Ludmijla.
200880,Lukas,Arcebispo Sabá de Toronto.
200881,Luke Fellows,"Sabá: Se Luke sangrar com sucesso, ele destrava no final da ação."
200882,Lula Burch,Sabá.
200883,"Luma, Stone Beauty",Escravo de Tremere da Camarilla: Vôo [FLIGHT].
200884,Lumumba,Laibon.
200885,Luna Giovanni,"Independente. 1 voto (titulado): Durante a etapa de votação de qualquer referendo, Luna pode remover X cartas de ação política em qualquer pilha de cinzas do jogo para obter +X votos."
200886,"Lupe ""Cabbie22"" Droin","Se Lupe tiver um veículo, uma vez a cada ação ela pode queimar uma condenação [1 CONVICTION] para obter +1 de furtividade ou +1 de percepção."
200887,Lupo,Camarilla.
200888,Lupo Giovanni,"Independente: Se Lupo estiver pronto durante sua fase de destravar, outro Giovanni pronto que você controla pode ganhar 1 de sangue."
200889,Luther,Sabá: Luther recebe +1 de sangramento ao sangrar um Matusalém que controla um Pander pronto.
200890,Lutz von Hohenzollern,"Circulo Interno Camarilla Malkaviano: Se Lutz estiver pronto, sua presa queima 1 de recurso depois que o referendo de uma ação política for bem-sucedido. +2 de sangrar."
200892,Lydia Van Cuelen,Camarilla: +1 de sangrar.
200891,"Lydia, Grande Praetor","Independente. 1 voto (titulado): Durante uma ação, Lydia pode queimar 1 de sangue para receber +1 de furtividade. Ela não pode usar cartas que requerem Rapidez [cel]. Escarço."
200893,Lynn Thompson,Camarilla: Lynn não pode ter um refúgio (em vez disso qualquer refúgio que ela receberia é queimado).
200894,MacAlister Marshall,Camarilla: Outros Tremere recebem +1 de percepção durante ações (D) contra MacAlister.
200895,Macoute,Independente.
200896,Madame Guil,Camarilla Toreador Justicar: +1 de sangrar.
200897,Madeleine Giovanni,"Independente: Depois de um servo em combate com Madeleine sair da região pronta, seu controlador queima 1 de recurso."
201557,Madison,Camarilla.
200898,Magdelena Schaefer,Camarilla: Cartas de ataque que requerem Taumaturgia [tha] custam a Magdalena um sangue adicional.
201633,Maila,"Primogênito Camarilla: Se Maila estiver pronta durante seu turno, você pode descartar uma carta de ação política para dar a um servo que você controla +1 de furtividade para a ação atual."
200899,"Makarios, o Sedutor","Camarilla: Como uma ação (D), Makarios pode colocar um contador de sedução em um Ventrue ou Brujah controlado por sua presa. Aquele vampiro pode queimar o contador com uma ação. Makarios não pode ser bloqueado por vampiros com um contador de sedução. +1 de sangrar."
200900,Malabranca,"Arcebispo Sabá de Roma: Se sua presa tem mais recursos que você, Malabranca pode mover um contador dos recursos de sua presa para o seu com uma ação (D) com  +1 de furtividade."
200901,Malachai,Independente: Vôo [FLIGHT].
201676,Malachi,Independente.
200902,Malcolm,Independente.
200903,Maldavis,Camarilla: Qualquer primógeno pronto pode queimar 1 de sangue de Maldavis como uma ação (D) com +1 de furtividade. Maldavis recebe -1 de sangrar ao sangrar um Matusalém que controla um primógeno pronto.
200904,Maldavis,"Anarquista: Primogênitos recebem +1 voto em referendos convocados por Maldavis.
[MERGED] Barão de Chicago."
200905,Malgorzata,Priscus Sabá: Malgorzata pode remover um vampiro em sua região não-controlada do jogo para adicionar 4 de sangue do banco de sangue em sua região não-controlada como uma ação com +1 de furtividade.
200906,Mamadou Keita,Laibon Magaji: Mamadou pode chamar um referendo para causar 1 de dano que não pode ser previnido em um servo pronto como uma ação política com +1 de furtividade.
200907,Maman Boumba,"Durante um referendo, Maman pode queimar uma convicção [1 CONVICTION] para receber 3 votos contra o referendo. Você pode travar Maman antes da distância ser determinada em um combate entre dois monstros para terminar aquele combate."
200908,Mambo Jeanne,Independente: Servos em combate contra Jeanne recebem 2 de dano ambiental por rodada durante a resolução normal de golpe a curta distância. +1 de sangrar.
201600,Marcel,Anarquista.
200909,Marcel de Breau,"Arcebispo do Sabá de Paris: Se você tiver a Vantagem, você ganha uma recurso quando qualquer Matusalém jogar uma carta da Gehenna. +1 de sangrar."
200910,Marcellus,"Príncipe Camarilla de Monaco: Se Marcellus estiver pronto, ações políticas custam 1 de sangue adicional a Nosferatus. +1 de sangrar."
200911,March Halcyon,"Sabá: Se March for diablerizada, nenhuma caçada de sangue pode ser chamada."
200912,Marcia Felicia Licinia,"Indepentende. 2 votos (titulado): Uma vez por combate, Marcia pode queimar 1 de sangue para golpear: esquiva."
200913,"Marciana Giovanni, Investigadora","Independente: Ações de sangrar custam a Marciana 1 sangue adicional. Durante uma ação, você pode travá-la e escolher um vampiro que não seja do Sabá para permitir que esse vampiro queime 1 sangue para obter +1 de percepção."
200914,Marconius,Arcebispo Sabá de Strasbourg: Cartas que requerem Mytherceria [myt] cusam a Marconius 1 de sangue a menos. +1 de força.{}
200916,Marcus Vitel,"Sabá: Qualquer Brujah pode entrar em combate com Marcus como uma ação (D).
[MERGED] Enquanto ele está pronto e for do Sabá, Vampiros do Sabá que você controla recebem +1 de sangrar contra um Matusalém que controlar um vampiro da Camarilla pronto."
